{
    "type": "object",
    "properties": {
        "pro1": {
            "type": "integer"
        },
        "pro2": {
            "type": "integer"
        },
        "pro3": {
            "type": "integer"
        },
        "pro4": {
            "type": "integer"
        },
        "pro5": {
            "type": "integer"
        },
        "pro6": {
            "type": "integer"
        }
    },
    "required": ["pro1", "pro2"],
    "patternProperties": {
        "pattern[0-9]+": {
            "description":"这个属性改名应该满足表达式 pattern[0-9]+",
            "type": "number"
        }
    },
    "additionalProperties": {
        "type":"number",
        "description": "这是 additionalProperties，应当<50",
        "maximum": 50
    }
}